participant.id_in_session,participant.code,participant.label,participant._is_bot,participant._index_in_pages,participant._max_page_index,participant._current_app_name,participant._current_page_name,participant.time_started_utc,participant.visited,participant.mturk_worker_id,participant.mturk_assignment_id,participant.payoff,participant.image_data,participant.audio_source_id,participant.video_source_id,session.code,session.label,session.mturk_HITId,session.mturk_HITGroupId,session.comment,session.is_demo,session.config.id,session.config.participant_label_file,session.config.participation_fee,session.config.real_world_currency_per_point,session.config.name,meeting_visual_smile_N8.1.player.id_in_group,meeting_visual_smile_N8.1.player.role,meeting_visual_smile_N8.1.player.payoff,meeting_visual_smile_N8.1.player.sid,meeting_visual_smile_N8.1.player.num_rounds,meeting_visual_smile_N8.1.player.user_id,meeting_visual_smile_N8.1.player.other_id,meeting_visual_smile_N8.1.player.other_id_in_group,meeting_visual_smile_N8.1.player.dyad,meeting_visual_smile_N8.1.player.primary,meeting_visual_smile_N8.1.player.conversation_topic,meeting_visual_smile_N8.1.player.conversation_description,meeting_visual_smile_N8.1.player.participant_condition,meeting_visual_smile_N8.1.player.other_condition,meeting_visual_smile_N8.1.player.audio_source_id,meeting_visual_smile_N8.1.player.video_source_id,meeting_visual_smile_N8.1.player.inspect_visibility,meeting_visual_smile_N8.1.player.participant_video,meeting_visual_smile_N8.1.player.other_video,meeting_visual_smile_N8.1.player.liked,meeting_visual_smile_N8.1.player.other_liked,meeting_visual_smile_N8.1.player.conversation_quality,meeting_visual_smile_N8.1.player.video_conf_quality,meeting_visual_smile_N8.1.player.final_quality,meeting_visual_smile_N8.1.player.final_quality_comment,meeting_visual_smile_N8.1.player.final_conversation_fidelity,meeting_visual_smile_N8.1.player.final_conversation_fidelity_comment,meeting_visual_smile_N8.1.player.final_xp_goal,meeting_visual_smile_N8.1.player.final_manipulation,meeting_visual_smile_N8.1.player.final_manipulation_comment,meeting_visual_smile_N8.1.player.second_date,meeting_visual_smile_N8.1.player.prolific_id,meeting_visual_smile_N8.1.player.share_prolific_id,meeting_visual_smile_N8.1.group.id_in_subsession,meeting_visual_smile_N8.1.subsession.round_number,meeting_visual_smile_N8.2.player.id_in_group,meeting_visual_smile_N8.2.player.role,meeting_visual_smile_N8.2.player.payoff,meeting_visual_smile_N8.2.player.sid,meeting_visual_smile_N8.2.player.num_rounds,meeting_visual_smile_N8.2.player.user_id,meeting_visual_smile_N8.2.player.other_id,meeting_visual_smile_N8.2.player.other_id_in_group,meeting_visual_smile_N8.2.player.dyad,meeting_visual_smile_N8.2.player.primary,meeting_visual_smile_N8.2.player.conversation_topic,meeting_visual_smile_N8.2.player.conversation_description,meeting_visual_smile_N8.2.player.participant_condition,meeting_visual_smile_N8.2.player.other_condition,meeting_visual_smile_N8.2.player.audio_source_id,meeting_visual_smile_N8.2.player.video_source_id,meeting_visual_smile_N8.2.player.inspect_visibility,meeting_visual_smile_N8.2.player.participant_video,meeting_visual_smile_N8.2.player.other_video,meeting_visual_smile_N8.2.player.liked,meeting_visual_smile_N8.2.player.other_liked,meeting_visual_smile_N8.2.player.conversation_quality,meeting_visual_smile_N8.2.player.video_conf_quality,meeting_visual_smile_N8.2.player.final_quality,meeting_visual_smile_N8.2.player.final_quality_comment,meeting_visual_smile_N8.2.player.final_conversation_fidelity,meeting_visual_smile_N8.2.player.final_conversation_fidelity_comment,meeting_visual_smile_N8.2.player.final_xp_goal,meeting_visual_smile_N8.2.player.final_manipulation,meeting_visual_smile_N8.2.player.final_manipulation_comment,meeting_visual_smile_N8.2.player.second_date,meeting_visual_smile_N8.2.player.prolific_id,meeting_visual_smile_N8.2.player.share_prolific_id,meeting_visual_smile_N8.2.group.id_in_subsession,meeting_visual_smile_N8.2.subsession.round_number,meeting_visual_smile_N8.3.player.id_in_group,meeting_visual_smile_N8.3.player.role,meeting_visual_smile_N8.3.player.payoff,meeting_visual_smile_N8.3.player.sid,meeting_visual_smile_N8.3.player.num_rounds,meeting_visual_smile_N8.3.player.user_id,meeting_visual_smile_N8.3.player.other_id,meeting_visual_smile_N8.3.player.other_id_in_group,meeting_visual_smile_N8.3.player.dyad,meeting_visual_smile_N8.3.player.primary,meeting_visual_smile_N8.3.player.conversation_topic,meeting_visual_smile_N8.3.player.conversation_description,meeting_visual_smile_N8.3.player.participant_condition,meeting_visual_smile_N8.3.player.other_condition,meeting_visual_smile_N8.3.player.audio_source_id,meeting_visual_smile_N8.3.player.video_source_id,meeting_visual_smile_N8.3.player.inspect_visibility,meeting_visual_smile_N8.3.player.participant_video,meeting_visual_smile_N8.3.player.other_video,meeting_visual_smile_N8.3.player.liked,meeting_visual_smile_N8.3.player.other_liked,meeting_visual_smile_N8.3.player.conversation_quality,meeting_visual_smile_N8.3.player.video_conf_quality,meeting_visual_smile_N8.3.player.final_quality,meeting_visual_smile_N8.3.player.final_quality_comment,meeting_visual_smile_N8.3.player.final_conversation_fidelity,meeting_visual_smile_N8.3.player.final_conversation_fidelity_comment,meeting_visual_smile_N8.3.player.final_xp_goal,meeting_visual_smile_N8.3.player.final_manipulation,meeting_visual_smile_N8.3.player.final_manipulation_comment,meeting_visual_smile_N8.3.player.second_date,meeting_visual_smile_N8.3.player.prolific_id,meeting_visual_smile_N8.3.player.share_prolific_id,meeting_visual_smile_N8.3.group.id_in_subsession,meeting_visual_smile_N8.3.subsession.round_number,meeting_visual_smile_N8.4.player.id_in_group,meeting_visual_smile_N8.4.player.role,meeting_visual_smile_N8.4.player.payoff,meeting_visual_smile_N8.4.player.sid,meeting_visual_smile_N8.4.player.num_rounds,meeting_visual_smile_N8.4.player.user_id,meeting_visual_smile_N8.4.player.other_id,meeting_visual_smile_N8.4.player.other_id_in_group,meeting_visual_smile_N8.4.player.dyad,meeting_visual_smile_N8.4.player.primary,meeting_visual_smile_N8.4.player.conversation_topic,meeting_visual_smile_N8.4.player.conversation_description,meeting_visual_smile_N8.4.player.participant_condition,meeting_visual_smile_N8.4.player.other_condition,meeting_visual_smile_N8.4.player.audio_source_id,meeting_visual_smile_N8.4.player.video_source_id,meeting_visual_smile_N8.4.player.inspect_visibility,meeting_visual_smile_N8.4.player.participant_video,meeting_visual_smile_N8.4.player.other_video,meeting_visual_smile_N8.4.player.liked,meeting_visual_smile_N8.4.player.other_liked,meeting_visual_smile_N8.4.player.conversation_quality,meeting_visual_smile_N8.4.player.video_conf_quality,meeting_visual_smile_N8.4.player.final_quality,meeting_visual_smile_N8.4.player.final_quality_comment,meeting_visual_smile_N8.4.player.final_conversation_fidelity,meeting_visual_smile_N8.4.player.final_conversation_fidelity_comment,meeting_visual_smile_N8.4.player.final_xp_goal,meeting_visual_smile_N8.4.player.final_manipulation,meeting_visual_smile_N8.4.player.final_manipulation_comment,meeting_visual_smile_N8.4.player.second_date,meeting_visual_smile_N8.4.player.prolific_id,meeting_visual_smile_N8.4.player.share_prolific_id,meeting_visual_smile_N8.4.group.id_in_subsession,meeting_visual_smile_N8.4.subsession.round_number,brainstorm_smile_av.1.player.id_in_group,brainstorm_smile_av.1.player.role,brainstorm_smile_av.1.player.payoff,brainstorm_smile_av.1.player.sid,brainstorm_smile_av.1.player.num_rounds,brainstorm_smile_av.1.player.user_id,brainstorm_smile_av.1.player.other_id,brainstorm_smile_av.1.player.other_id_in_group,brainstorm_smile_av.1.player.dyad,brainstorm_smile_av.1.player.primary,brainstorm_smile_av.1.player.conversation_topic,brainstorm_smile_av.1.player.conversation_description,brainstorm_smile_av.1.player.participant_condition,brainstorm_smile_av.1.player.audio_source_id,brainstorm_smile_av.1.player.video_source_id,brainstorm_smile_av.1.player.inspect_visibility,brainstorm_smile_av.1.player.participant_videos,brainstorm_smile_av.1.player.other_videos,brainstorm_smile_av.1.player.liked,brainstorm_smile_av.1.player.other_liked,brainstorm_smile_av.1.player.conversation_quality,brainstorm_smile_av.1.player.video_conf_quality,brainstorm_smile_av.1.player.final_quality,brainstorm_smile_av.1.player.final_quality_comment,brainstorm_smile_av.1.player.final_conversation_fidelity,brainstorm_smile_av.1.player.final_conversation_fidelity_comment,brainstorm_smile_av.1.player.final_xp_goal,brainstorm_smile_av.1.player.final_manipulation,brainstorm_smile_av.1.player.final_manipulation_comment,brainstorm_smile_av.1.group.id_in_subsession,brainstorm_smile_av.1.subsession.round_number,brainstorm_smile_av.2.player.id_in_group,brainstorm_smile_av.2.player.role,brainstorm_smile_av.2.player.payoff,brainstorm_smile_av.2.player.sid,brainstorm_smile_av.2.player.num_rounds,brainstorm_smile_av.2.player.user_id,brainstorm_smile_av.2.player.other_id,brainstorm_smile_av.2.player.other_id_in_group,brainstorm_smile_av.2.player.dyad,brainstorm_smile_av.2.player.primary,brainstorm_smile_av.2.player.conversation_topic,brainstorm_smile_av.2.player.conversation_description,brainstorm_smile_av.2.player.participant_condition,brainstorm_smile_av.2.player.audio_source_id,brainstorm_smile_av.2.player.video_source_id,brainstorm_smile_av.2.player.inspect_visibility,brainstorm_smile_av.2.player.participant_videos,brainstorm_smile_av.2.player.other_videos,brainstorm_smile_av.2.player.liked,brainstorm_smile_av.2.player.other_liked,brainstorm_smile_av.2.player.conversation_quality,brainstorm_smile_av.2.player.video_conf_quality,brainstorm_smile_av.2.player.final_quality,brainstorm_smile_av.2.player.final_quality_comment,brainstorm_smile_av.2.player.final_conversation_fidelity,brainstorm_smile_av.2.player.final_conversation_fidelity_comment,brainstorm_smile_av.2.player.final_xp_goal,brainstorm_smile_av.2.player.final_manipulation,brainstorm_smile_av.2.player.final_manipulation_comment,brainstorm_smile_av.2.group.id_in_subsession,brainstorm_smile_av.2.subsession.round_number,brainstorm_smile_av.3.player.id_in_group,brainstorm_smile_av.3.player.role,brainstorm_smile_av.3.player.payoff,brainstorm_smile_av.3.player.sid,brainstorm_smile_av.3.player.num_rounds,brainstorm_smile_av.3.player.user_id,brainstorm_smile_av.3.player.other_id,brainstorm_smile_av.3.player.other_id_in_group,brainstorm_smile_av.3.player.dyad,brainstorm_smile_av.3.player.primary,brainstorm_smile_av.3.player.conversation_topic,brainstorm_smile_av.3.player.conversation_description,brainstorm_smile_av.3.player.participant_condition,brainstorm_smile_av.3.player.audio_source_id,brainstorm_smile_av.3.player.video_source_id,brainstorm_smile_av.3.player.inspect_visibility,brainstorm_smile_av.3.player.participant_videos,brainstorm_smile_av.3.player.other_videos,brainstorm_smile_av.3.player.liked,brainstorm_smile_av.3.player.other_liked,brainstorm_smile_av.3.player.conversation_quality,brainstorm_smile_av.3.player.video_conf_quality,brainstorm_smile_av.3.player.final_quality,brainstorm_smile_av.3.player.final_quality_comment,brainstorm_smile_av.3.player.final_conversation_fidelity,brainstorm_smile_av.3.player.final_conversation_fidelity_comment,brainstorm_smile_av.3.player.final_xp_goal,brainstorm_smile_av.3.player.final_manipulation,brainstorm_smile_av.3.player.final_manipulation_comment,brainstorm_smile_av.3.group.id_in_subsession,brainstorm_smile_av.3.subsession.round_number,brainstorm_smile_av.4.player.id_in_group,brainstorm_smile_av.4.player.role,brainstorm_smile_av.4.player.payoff,brainstorm_smile_av.4.player.sid,brainstorm_smile_av.4.player.num_rounds,brainstorm_smile_av.4.player.user_id,brainstorm_smile_av.4.player.other_id,brainstorm_smile_av.4.player.other_id_in_group,brainstorm_smile_av.4.player.dyad,brainstorm_smile_av.4.player.primary,brainstorm_smile_av.4.player.conversation_topic,brainstorm_smile_av.4.player.conversation_description,brainstorm_smile_av.4.player.participant_condition,brainstorm_smile_av.4.player.audio_source_id,brainstorm_smile_av.4.player.video_source_id,brainstorm_smile_av.4.player.inspect_visibility,brainstorm_smile_av.4.player.participant_videos,brainstorm_smile_av.4.player.other_videos,brainstorm_smile_av.4.player.liked,brainstorm_smile_av.4.player.other_liked,brainstorm_smile_av.4.player.conversation_quality,brainstorm_smile_av.4.player.video_conf_quality,brainstorm_smile_av.4.player.final_quality,brainstorm_smile_av.4.player.final_quality_comment,brainstorm_smile_av.4.player.final_conversation_fidelity,brainstorm_smile_av.4.player.final_conversation_fidelity_comment,brainstorm_smile_av.4.player.final_xp_goal,brainstorm_smile_av.4.player.final_manipulation,brainstorm_smile_av.4.player.final_manipulation_comment,brainstorm_smile_av.4.group.id_in_subsession,brainstorm_smile_av.4.subsession.round_number,ducksoup_now.1.player.id_in_group,ducksoup_now.1.player.role,ducksoup_now.1.player.payoff,ducksoup_now.1.player.sid,ducksoup_now.1.player.num_rounds,ducksoup_now.1.player.user_id,ducksoup_now.1.player.other_id,ducksoup_now.1.player.other_id_in_group,ducksoup_now.1.player.dyad,ducksoup_now.1.player.primary,ducksoup_now.1.player.inspect_visibility,ducksoup_now.1.player.participant_videos,ducksoup_now.1.player.other_videos,ducksoup_now.1.group.id_in_subsession,ducksoup_now.1.subsession.round_number,ducksoup_now.2.player.id_in_group,ducksoup_now.2.player.role,ducksoup_now.2.player.payoff,ducksoup_now.2.player.sid,ducksoup_now.2.player.num_rounds,ducksoup_now.2.player.user_id,ducksoup_now.2.player.other_id,ducksoup_now.2.player.other_id_in_group,ducksoup_now.2.player.dyad,ducksoup_now.2.player.primary,ducksoup_now.2.player.inspect_visibility,ducksoup_now.2.player.participant_videos,ducksoup_now.2.player.other_videos,ducksoup_now.2.group.id_in_subsession,ducksoup_now.2.subsession.round_number,ducksoup_now.3.player.id_in_group,ducksoup_now.3.player.role,ducksoup_now.3.player.payoff,ducksoup_now.3.player.sid,ducksoup_now.3.player.num_rounds,ducksoup_now.3.player.user_id,ducksoup_now.3.player.other_id,ducksoup_now.3.player.other_id_in_group,ducksoup_now.3.player.dyad,ducksoup_now.3.player.primary,ducksoup_now.3.player.inspect_visibility,ducksoup_now.3.player.participant_videos,ducksoup_now.3.player.other_videos,ducksoup_now.3.group.id_in_subsession,ducksoup_now.3.subsession.round_number,ducksoup_now.4.player.id_in_group,ducksoup_now.4.player.role,ducksoup_now.4.player.payoff,ducksoup_now.4.player.sid,ducksoup_now.4.player.num_rounds,ducksoup_now.4.player.user_id,ducksoup_now.4.player.other_id,ducksoup_now.4.player.other_id_in_group,ducksoup_now.4.player.dyad,ducksoup_now.4.player.primary,ducksoup_now.4.player.inspect_visibility,ducksoup_now.4.player.participant_videos,ducksoup_now.4.player.other_videos,ducksoup_now.4.group.id_in_subsession,ducksoup_now.4.subsession.round_number
1,5o9i87by,P01,0,40,40,meeting_visual_smile_N8,MeetingProlificCompensation,2024-01-12 15:27:54.735566,1,,,0.0,,default,e717ba67e798e0e67a0a1b0eb383cb57dae618c4beaf31a6d11d99a26c9dd811,w6stl8u1,,,,,0,mk:prolific_participant_real_2:2,_rooms/n8.txt,0.0,1.0,meeting_visual_smile_N8,1,,0.0,mk:prolific_participant_real_2:2,4,p1,p5,2,p1p5,1,,,U,U,default,e717ba67e798e0e67a0a1b0eb383cb57dae618c4beaf31a6d11d99a26c9dd811,,,,7,6,6,6,,,,,,,,yes,,,1,1,1,,0.0,mk:prolific_participant_real_2:2,4,p1,p8,2,p1p8,1,,,U,S,,,,,,4,4,4,4,,,,,,,,no,,,1,2,1,,0.0,mk:prolific_participant_real_2:2,4,p1,p6,2,p1p6,1,,,S,U,,,,,,4,4,4,4,,,,,,,,no,,,1,3,1,,0.0,mk:prolific_participant_real_2:2,4,p1,p7,2,p1p7,1,,,S,S,,,,,,7,6,7,7,1,I had no interactions for rounds 2 and 3 because they did not load.  ,4,No interactions for round 2 and 3,To explore if you held a similar opinion about how the interaction went. ,2,The interactions felt natural ,yes,5efb49177e130c0785b93842,no,1,4,,,,,,,,,,,,,,,,,,,,,,,,,,,,,,,,,,,,,,,,,,,,,,,,,,,,,,,,,,,,,,,,,,,,,,,,,,,,,,,,,,,,,,,,,,,,,,,,,,,,,,,,,,,,,,,,,,,,,,,,,,,,,,,,,,,,,,,,,,,,,,,,,,,,,,,,,,,,,,,,,,,,,,,,,,,,,,,,,,,,,,,,
2,3hir19g1,P02,0,40,40,meeting_visual_smile_N8,MeetingProlificCompensation,2024-01-12 15:27:55.705742,1,,,0.0,,default,84f7223b9e93b581924220c9f23866595cf77cf1d0995907353292d7d28052f9,w6stl8u1,,,,,0,mk:prolific_participant_real_2:2,_rooms/n8.txt,0.0,1.0,meeting_visual_smile_N8,1,,0.0,mk:prolific_participant_real_2:2,4,p2,p6,2,p2p6,1,,,U,S,default,84f7223b9e93b581924220c9f23866595cf77cf1d0995907353292d7d28052f9,,,,5,5,6,5,,,,,,,,no,,,2,1,1,,0.0,mk:prolific_participant_real_2:2,4,p2,p7,2,p2p7,1,,,U,U,,,,,,6,5,6,6,,,,,,,,no,,,2,2,1,,0.0,mk:prolific_participant_real_2:2,4,p2,p5,2,p2p5,1,,,S,S,,,,,,6,6,6,6,,,,,,,,no,,,2,3,1,,0.0,mk:prolific_participant_real_2:2,4,p2,p8,2,p2p8,1,,,S,U,,,,,,4,4,4,4,4,"stuttering of the picture, in my opinion the images were pale in colour (not as deep as real life colour)",4,waiting for session to start. ,Judging by the questions a new audio visual chat option. On the other hand it could about how conversation flows.,4,i dont know the people involved so i have no idea if they are a smiley person or not. ,no,652be58c7d5885fc2d4abe9e,no,2,4,,,,,,,,,,,,,,,,,,,,,,,,,,,,,,,,,,,,,,,,,,,,,,,,,,,,,,,,,,,,,,,,,,,,,,,,,,,,,,,,,,,,,,,,,,,,,,,,,,,,,,,,,,,,,,,,,,,,,,,,,,,,,,,,,,,,,,,,,,,,,,,,,,,,,,,,,,,,,,,,,,,,,,,,,,,,,,,,,,,,,,,,
3,scd3h1i4,P03,0,40,40,meeting_visual_smile_N8,MeetingProlificCompensation,2024-01-12 15:27:54.890143,1,,,0.0,,default,96a832449c045409b20c6baafd07232011ab93b4646eb1935cbd5589d3ab01ba,w6stl8u1,,,,,0,mk:prolific_participant_real_2:2,_rooms/n8.txt,0.0,1.0,meeting_visual_smile_N8,1,,0.0,mk:prolific_participant_real_2:2,4,p3,p7,2,p3p7,1,,,S,U,default,96a832449c045409b20c6baafd07232011ab93b4646eb1935cbd5589d3ab01ba,,,,6,6,6,7,,,,,,,,no,,,3,1,1,,0.0,mk:prolific_participant_real_2:2,4,p3,p6,2,p3p6,1,,,S,S,,,,,,5,5,3,3,,,,,,,,no,,,3,2,1,,0.0,mk:prolific_participant_real_2:2,4,p3,p8,2,p3p8,1,,,U,U,,,,,,6,6,6,7,,,,,,,,no,,,3,3,1,,0.0,mk:prolific_participant_real_2:2,4,p3,p5,2,p3p5,1,,,U,S,,,,,,6,6,7,7,6,"Friendly and positive , about family, work and your interests and about what pets you have , And it felt very positive and friendly.",6,"There was one conversation where their camera froze for the first 2 or 3 minutes.  But then when I reloaded the page it started to work fine, like it did with the others and we had a nice interaction.    Overall the interactions were very clear. It felt comfortable to be face to face as they were very friendly lovely people. ",To see how first time interactions with strangers feel and get feedback from people on how they felt about these interactions. ,1,"As the people I spoke to , felt very natural and real, and very friendly and kind.",no,5ef5f74fb4a08f2676fb3aba,no,3,4,,,,,,,,,,,,,,,,,,,,,,,,,,,,,,,,,,,,,,,,,,,,,,,,,,,,,,,,,,,,,,,,,,,,,,,,,,,,,,,,,,,,,,,,,,,,,,,,,,,,,,,,,,,,,,,,,,,,,,,,,,,,,,,,,,,,,,,,,,,,,,,,,,,,,,,,,,,,,,,,,,,,,,,,,,,,,,,,,,,,,,,,
4,ncs2semq,P04,0,40,40,meeting_visual_smile_N8,MeetingProlificCompensation,2024-01-12 15:27:54.703401,1,,,0.0,,default,a3b3315fa0be22253fa18e8185ff7cd7449489a8a62e9b734b0ce505198613b5,w6stl8u1,,,,,0,mk:prolific_participant_real_2:2,_rooms/n8.txt,0.0,1.0,meeting_visual_smile_N8,1,,0.0,mk:prolific_participant_real_2:2,4,p4,p8,2,p4p8,1,,,S,S,default,a3b3315fa0be22253fa18e8185ff7cd7449489a8a62e9b734b0ce505198613b5,,,,6,5,5,6,,,,,,,,yes,,,4,1,1,,0.0,mk:prolific_participant_real_2:2,4,p4,p5,2,p4p5,1,,,S,U,,,,,,4,4,4,5,,,,,,,,no,,,4,2,1,,0.0,mk:prolific_participant_real_2:2,4,p4,p7,2,p4p7,1,,,U,S,,,,,,4,4,4,5,,,,,,,,no,,,4,3,1,,0.0,mk:prolific_participant_real_2:2,4,p4,p6,2,p4p6,1,,,U,U,,,,,,5,5,4,3,3,Very poor quality sound with the last person,3,Poor quality with the last person meant that the conversation did not flow very well,I am unsure,3,The conversations seemed natural,no,5c5d306d935f3500016f64ac,no,4,4,,,,,,,,,,,,,,,,,,,,,,,,,,,,,,,,,,,,,,,,,,,,,,,,,,,,,,,,,,,,,,,,,,,,,,,,,,,,,,,,,,,,,,,,,,,,,,,,,,,,,,,,,,,,,,,,,,,,,,,,,,,,,,,,,,,,,,,,,,,,,,,,,,,,,,,,,,,,,,,,,,,,,,,,,,,,,,,,,,,,,,,,
5,syroo0m5,P05,0,40,40,meeting_visual_smile_N8,MeetingProlificCompensation,2024-01-12 15:27:54.715758,1,,,0.0,,default,b3f8e05c815b5c248bf29187c5fca62e703dbc5c837a6937d125de0857a48ffe,w6stl8u1,,,,,0,mk:prolific_participant_real_2:2,_rooms/n8.txt,0.0,1.0,meeting_visual_smile_N8,2,,0.0,mk:prolific_participant_real_2:2,4,p5,p1,1,p1p5,0,,,U,U,default,b3f8e05c815b5c248bf29187c5fca62e703dbc5c837a6937d125de0857a48ffe,,,,7,6,7,7,,,,,,,,yes,,,1,1,2,,0.0,mk:prolific_participant_real_2:2,4,p5,p4,1,p4p5,0,,,U,S,,,,,,5,4,4,6,,,,,,,,no,,,4,2,2,,0.0,mk:prolific_participant_real_2:2,4,p5,p2,1,p2p5,0,,,S,S,,,,,,6,6,6,6,,,,,,,,yes,,,2,3,2,,0.0,mk:prolific_participant_real_2:2,4,p5,p3,1,p3p5,0,,,S,U,,,,,,5,5,5,6,5,"None, although maybe a wee bit of lag, in terms of two people speaking at once but that is often the case with videoconferencing",5,"Natural conversation, often the two people spoke at the same time, then we both paused",Testing equipment and seeing how two strangers were able to strike up a conversation and get their initial thoughts on that individual after only 4 mins.,2,"It felt very natural, nothing altered",no,6440ec657d3df6f5223edc73,no,3,4,,,,,,,,,,,,,,,,,,,,,,,,,,,,,,,,,,,,,,,,,,,,,,,,,,,,,,,,,,,,,,,,,,,,,,,,,,,,,,,,,,,,,,,,,,,,,,,,,,,,,,,,,,,,,,,,,,,,,,,,,,,,,,,,,,,,,,,,,,,,,,,,,,,,,,,,,,,,,,,,,,,,,,,,,,,,,,,,,,,,,,,,
6,nztxf4vd,P06,0,40,40,meeting_visual_smile_N8,MeetingProlificCompensation,2024-01-12 15:27:54.787594,1,,,0.0,,default,3a6eea163c2dbdac9bfb361af79359b18d24db5da0c54c2d18318e70e44ff045,w6stl8u1,,,,,0,mk:prolific_participant_real_2:2,_rooms/n8.txt,0.0,1.0,meeting_visual_smile_N8,2,,0.0,mk:prolific_participant_real_2:2,4,p6,p2,1,p2p6,0,,,S,U,default,3a6eea163c2dbdac9bfb361af79359b18d24db5da0c54c2d18318e70e44ff045,,,,5,4,5,5,,,,,,,,yes,,,2,1,2,,0.0,mk:prolific_participant_real_2:2,4,p6,p3,1,p3p6,0,,,S,S,,,,,,5,5,5,4,,,,,,,,yes,,,3,2,2,,0.0,mk:prolific_participant_real_2:2,4,p6,p1,1,p1p6,0,,,U,S,,,,,,1,1,1,5,,,,,,,,no,,,1,3,2,,0.0,mk:prolific_participant_real_2:2,4,p6,p4,1,p4p6,0,,,U,U,,,,,,4,4,4,4,4,"background noise, video freezing",4,none,to test video interaction between people and to know if video quality influeces the way people interact with others.,7,The person was unresponsive and i could see a filter of a smile on the lady's face as she moved.,no,655e0caf42f7ea9ec02cdc3c,yes,4,4,,,,,,,,,,,,,,,,,,,,,,,,,,,,,,,,,,,,,,,,,,,,,,,,,,,,,,,,,,,,,,,,,,,,,,,,,,,,,,,,,,,,,,,,,,,,,,,,,,,,,,,,,,,,,,,,,,,,,,,,,,,,,,,,,,,,,,,,,,,,,,,,,,,,,,,,,,,,,,,,,,,,,,,,,,,,,,,,,,,,,,,,
7,4v6hhoi9,P07,0,40,40,meeting_visual_smile_N8,MeetingProlificCompensation,2024-01-12 15:27:55.039079,1,,,0.0,,default,0968af86a0274472777e1e5ba6981a4420ddcdd035fcc9f844ec8dea4b41c804,w6stl8u1,,,,,0,mk:prolific_participant_real_2:2,_rooms/n8.txt,0.0,1.0,meeting_visual_smile_N8,2,,0.0,mk:prolific_participant_real_2:2,4,p7,p3,1,p3p7,0,,,U,S,default,0968af86a0274472777e1e5ba6981a4420ddcdd035fcc9f844ec8dea4b41c804,,,,6,6,6,6,,,,,,,,yes,,,3,1,2,,0.0,mk:prolific_participant_real_2:2,4,p7,p2,1,p2p7,0,,,U,U,,,,,,6,6,6,6,,,,,,,,yes,,,2,2,2,,0.0,mk:prolific_participant_real_2:2,4,p7,p4,1,p4p7,0,,,S,U,,,,,,6,6,6,6,,,,,,,,yes,,,4,3,2,,0.0,mk:prolific_participant_real_2:2,4,p7,p1,1,p1p7,0,,,S,S,,,,,,6,6,6,6,4,none,4,none,to see how people interacted ,3,it seemed natural,yes,5f4cbdf9f599118d27c21442,no,1,4,,,,,,,,,,,,,,,,,,,,,,,,,,,,,,,,,,,,,,,,,,,,,,,,,,,,,,,,,,,,,,,,,,,,,,,,,,,,,,,,,,,,,,,,,,,,,,,,,,,,,,,,,,,,,,,,,,,,,,,,,,,,,,,,,,,,,,,,,,,,,,,,,,,,,,,,,,,,,,,,,,,,,,,,,,,,,,,,,,,,,,,,
8,q62h6xyd,P08,0,40,40,meeting_visual_smile_N8,MeetingProlificCompensation,2024-01-12 15:27:57.139216,1,,,0.0,,default,efc10578b43ba2c1811a03fe82c940772abcb41e827770106ae7f2b8cf0097fc,w6stl8u1,,,,,0,mk:prolific_participant_real_2:2,_rooms/n8.txt,0.0,1.0,meeting_visual_smile_N8,2,,0.0,mk:prolific_participant_real_2:2,4,p8,p4,1,p4p8,0,,,S,S,default,efc10578b43ba2c1811a03fe82c940772abcb41e827770106ae7f2b8cf0097fc,,,,7,7,7,7,,,,,,,,no,,,4,1,2,,0.0,mk:prolific_participant_real_2:2,4,p8,p1,1,p1p8,0,,,S,U,,,,,,1,1,1,1,,,,,,,,no,,,1,2,2,,0.0,mk:prolific_participant_real_2:2,4,p8,p3,1,p3p8,0,,,U,U,,,,,,5,5,5,6,,,,,,,,no,,,3,3,2,,0.0,mk:prolific_participant_real_2:2,4,p8,p2,1,p2p8,0,,,U,S,,,,,,2,2,2,2,4,Didnt notice any flaws.,4,I couldnt hear the participants I was interacting with .,Not entirely sure.,4,I couldnt tell.,no,6482e2aa5b920f6e156117e3,no,2,4,,,,,,,,,,,,,,,,,,,,,,,,,,,,,,,,,,,,,,,,,,,,,,,,,,,,,,,,,,,,,,,,,,,,,,,,,,,,,,,,,,,,,,,,,,,,,,,,,,,,,,,,,,,,,,,,,,,,,,,,,,,,,,,,,,,,,,,,,,,,,,,,,,,,,,,,,,,,,,,,,,,,,,,,,,,,,,,,,,,,,,,,
